{
  "schemaVersion": "0.2.0",
  "toolVersion": "0.2.0",
  "collectedOnUtc": "2026-09-10",
  "facts": {
    "system": {
      "windowsVersion": {
        "state": "available",
        "value": "10.0.26200",
        "source": "wmiOperatingSystem",
        "reason": "none"
      },
      "windowsBuild": {
        "state": "available",
        "value": "26200",
        "source": "wmiOperatingSystem",
        "reason": "none"
      },
      "manufacturer": {
        "state": "available",
        "value": "Example OEM",
        "source": "wmiComputerSystem",
        "reason": "none"
      },
      "model": {
        "state": "available",
        "value": "Example Model",
        "source": "wmiComputerSystem",
        "reason": "none"
      }
    },
    "gpus": {
      "state": "available",
      "value": [
        {
          "id": "gpu-1",
          "name": {
            "state": "available",
            "value": "Example GPU",
            "source": "wmiVideoController",
            "reason": "none"
          },
          "pciVendorId": {
            "state": "available",
            "value": "10DE",
            "source": "wmiVideoController",
            "reason": "none"
          },
          "pciDeviceId": {
            "state": "available",
            "value": "1234",
            "source": "wmiVideoController",
            "reason": "none"
          },
          "classification": {
            "state": "unsupported",
            "value": null,
            "source": "notCollected",
            "reason": "notImplemented"
          },
          "driver": {
            "provider": {
              "state": "available",
              "value": "Example Vendor",
              "source": "wmiSignedDriver",
              "reason": "none"
            },
            "version": {
              "state": "available",
              "value": "1.2.3.4",
              "source": "wmiSignedDriver",
              "reason": "none"
            },
            "date": {
              "state": "available",
              "value": "2026-09-01",
              "source": "wmiSignedDriver",
              "reason": "none"
            }
          }
        },
        {
          "id": "gpu-2",
          "name": {
            "state": "available",
            "value": "Example GPU",
            "source": "wmiVideoController",
            "reason": "none"
          },
          "pciVendorId": {
            "state": "available",
            "value": "10DE",
            "source": "wmiVideoController",
            "reason": "none"
          },
          "pciDeviceId": {
            "state": "available",
            "value": "1234",
            "source": "wmiVideoController",
            "reason": "none"
          },
          "classification": {
            "state": "unsupported",
            "value": null,
            "source": "notCollected",
            "reason": "notImplemented"
          },
          "driver": {
            "provider": {
              "state": "available",
              "value": "Example Vendor",
              "source": "wmiSignedDriver",
              "reason": "none"
            },
            "version": {
              "state": "available",
              "value": "1.2.3.4",
              "source": "wmiSignedDriver",
              "reason": "none"
            },
            "date": {
              "state": "available",
              "value": "2026-09-01",
              "source": "wmiSignedDriver",
              "reason": "none"
            }
          }
        }
      ],
      "source": "wmiVideoController",
      "reason": "none"
    },
    "displays": {
      "state": "available",
      "value": [
        {
          "id": "display-1",
          "sourceId": "source-1",
          "targetId": "target-1",
          "sourceAdapterId": "adapter-1",
          "targetAdapterId": "adapter-1",
          "sourceAdapter": {
            "state": "available",
            "value": {
              "gpuId": "gpu-2",
              "evidence": "exactSetupApiInstanceId",
              "confidence": "exact"
            },
            "source": "setupApiInstanceJoin",
            "reason": "none"
          },
          "targetAdapter": {
            "state": "available",
            "value": {
              "gpuId": "gpu-2",
              "evidence": "exactSetupApiInstanceId",
              "confidence": "exact"
            },
            "source": "setupApiInstanceJoin",
            "reason": "none"
          },
          "sourceGdiName": {
            "state": "available",
            "value": "\\\\.\\DISPLAY8",
            "source": "displayConfig",
            "reason": "none"
          },
          "name": {
            "state": "available",
            "value": "Example Panel",
            "source": "displayConfig",
            "reason": "none"
          },
          "outputTechnology": {
            "state": "available",
            "value": "displayPortEmbedded",
            "source": "displayConfig",
            "reason": "none"
          },
          "sourceResolution": {
            "state": "available",
            "value": {
              "widthPixels": 2560,
              "heightPixels": 1600
            },
            "source": "displayConfig",
            "reason": "none"
          },
          "pathRefreshRate": {
            "state": "available",
            "value": {
              "numerator": 165,
              "denominator": 1
            },
            "source": "displayConfig",
            "reason": "none"
          },
          "signalRefreshRate": {
            "state": "available",
            "value": {
              "numerator": 165000,
              "denominator": 1000
            },
            "source": "displayConfig",
            "reason": "none"
          },
          "rotation": {
            "state": "available",
            "value": "identity",
            "source": "displayConfig",
            "reason": "none"
          },
          "scanLineOrdering": {
            "state": "available",
            "value": "progressive",
            "source": "displayConfig",
            "reason": "none"
          },
          "pathActive": true,
          "targetAvailable": true,
          "refreshRateBoost": {
            "state": "available",
            "value": {
              "enabled": false
            },
            "source": "displayConfig",
            "reason": "none"
          },
          "cloneGroupId": {
            "state": "unknown",
            "value": null,
            "source": "displayConfig",
            "reason": "missingValue"
          },
          "queryMode": "virtualModeAndRefreshAware"
        }
      ],
      "source": "displayConfig",
      "reason": "none"
    }
  },
  "findings": [
    {
      "id": "inventory.multiple-adapters",
      "severity": "information",
      "message": "Windows reports multiple video controllers. This alone does not establish hybrid mode, display routing, GPU power state, or which GPU an application uses.",
      "evidence": [
        "facts.gpus"
      ]
    },
    {
      "id": "topology.endpoint-adapter-association",
      "severity": "information",
      "message": "For display-1, the source endpoint is exactly associated with gpu-2, and the target endpoint is exactly associated with gpu-2, through identity correlation in this report. These associations do not establish application rendering, workload ownership, electrical routing, GPU preference, power state, graphics mode, health, or driver correctness.",
      "evidence": [
        "facts.displays.value[0].id",
        "facts.displays.value[0].pathActive",
        "facts.displays.value[0].sourceAdapter",
        "facts.displays.value[0].targetAdapter"
      ]
    }
  ],
  "warnings": [
    "inventoryOnly",
    "providerReportedValues",
    "topologyIsNotRendering",
    "reviewBeforeSharing"
  ],
  "collection": [
    {
      "source": "wmiOperatingSystem",
      "status": "succeeded",
      "reason": "none",
      "attempts": 1,
      "queryMode": "notQueried",
      "issues": []
    },
    {
      "source": "wmiComputerSystem",
      "status": "succeeded",
      "reason": "none",
      "attempts": 1,
      "queryMode": "notQueried",
      "issues": []
    },
    {
      "source": "wmiVideoController",
      "status": "succeeded",
      "reason": "none",
      "attempts": 1,
      "queryMode": "notQueried",
      "issues": []
    },
    {
      "source": "displayConfig",
      "status": "succeeded",
      "reason": "none",
      "attempts": 1,
      "queryMode": "virtualModeAndRefreshAware",
      "issues": []
    },
    {
      "source": "wmiSignedDriver",
      "status": "succeeded",
      "reason": "none",
      "attempts": 1,
      "queryMode": "notQueried",
      "issues": []
    }
  ],
  "privacy": {
    "policyVersion": "0.2",
    "redactedFields": 0
  }
}
